<?xml version="1.0" encoding="utf-8"?>
<AbstractionBuilder xmlns="http://tempuri.org/absbuilder_v1_0.xsd" xmlns:xsi="http://www.w3.org/2001/XMLSchema-instance" xsi:schemaLocation="http://tempuri.org/absbuilder_v1_0.xsd ../../../../absbuilder/AbstractionBuilder/absbuilder/Content_v1_0/absbuilder_v1_0.xsd">
  <Builder>
    <Abstractions>
      <Abstraction name="Documentation">
        <Generator name="DesignDocumentation_v1_0"/>
      </Abstraction>
    </Abstractions>
    <Transformations>
      <Transformation name="StatusTrackingToDocumentation"
                      sourceAbstraction="StatusTracking"
                      targetAbstraction="Documentation"
                      />
    </Transformations>
    <BuildExecution>
      <!--
      <TransformationItem nameRef="StatusTrackingToDocumentation" />
      <AbstractionItem nameRef="Documentation"/>
      -->
    </BuildExecution>
  </Builder>
</AbstractionBuilder>
